{"schema":"vegastack-labs.dev/host-action-request","schemaVersion":"1.0.0","actionId":"test.write-file","actionVersion":"1.0.0","actionInputDigest":"sha256:44136fa355b3678a1146ad16f7e8649e94fb4fc21fe77e8310c060f61caaff8a","actionInput":"{}","hostId":"host-a","targetRevision":1,"targetDigest":"sha256:aaaaaaaaaaaaaaaaaaaaaaaaaaaaaaaaaaaaaaaaaaaaaaaaaaaaaaaaaaaaaaaa","automationPrincipalId":"automation-a","callerUid":1001,"credentialReferenceId":"reference-a","credentialMaterialVersion":"version-a","consoleConfirmation":{"schema":"vegastack-labs.dev/host-action-console-confirmation","schemaVersion":"1.0.0","method":"administrator-verified-console","targetDigest":"sha256:aaaaaaaaaaaaaaaaaaaaaaaaaaaaaaaaaaaaaaaaaaaaaaaaaaaaaaaaaaaaaaaa","hostIdentityDigest":"sha256:aaaaaaaaaaaaaaaaaaaaaaaaaaaaaaaaaaaaaaaaaaaaaaaaaaaaaaaaaaaaaaaa"},"expectedStateRevision":1,"recoveryEpoch":0,"idempotencyKey":"action-a"}
